Token,Description,Reference
MEID,Mobile Equipment Identifier (CDMA),[RFC-ietf-ecrit-additional-data-38]
ESN,Electronic Serial Number (GSM),[RFC-ietf-ecrit-additional-data-38]
MAC,Media Access Control Address (IEEE),[RFC-ietf-ecrit-additional-data-38]
WiMAX,Device Certificate Unique ID,[RFC-ietf-ecrit-additional-data-38]
IMEI,International Mobile Equipment ID (GSM),[RFC-ietf-ecrit-additional-data-38]
IMSI,International Mobile Subscriber ID (GSM),[RFC-ietf-ecrit-additional-data-38]
UDI,Unique Device Identifier,[RFC-ietf-ecrit-additional-data-38]
RFID,Radio Frequency Identification,[RFC-ietf-ecrit-additional-data-38]
SN,Manufacturer Serial Number,[RFC-ietf-ecrit-additional-data-38]
